,aid,code,text,correct
83,23064655,1822,A Palestinian was shot to death and 61 others were wounded in clashes between Israeli soldiers and Arabs who were angered by rumors that a Palestinian prisoner had been tortured to death in a military jail in the Gaza Strip.,1
84,23066061,1823,"\n\n\nThis steady spiral of violence began on Sunday, when a Palestinian from a small West Bank village stabbed three Jews to death in a quiet Jerusalem neighborhood, apparently to avenge the shooting deaths of 21 Palestinians at Al Aksa Mosque two weeks ago.",1
85,23076492,1823,"\nA 60-year old woman who sold dresses out of her home and a friend who was visiting her were stabbed to death early yesterday by an assailant she apparently let into her Washington Heights apartment, the police said.\nThe police found the woman, Bertha Ostrynski, in the front hallway of the six-room apartment at 825 West 179th Street.",1
86,23076492,1823,"A 60-year old woman who sold dresses out of her home and a friend who was visiting her were stabbed to death early yesterday by an assailant she apparently let into her Washington Heights apartment, the police said.",1
87,23081486,1711,"""In an effort to crackdown on what they said was an increase in underage drinking, the East Lansing police have confiscated more than 700 fake driver's licenses from students of Michigan State.""",1
88,23129886,1823,"""In a Nov 28, 1991 radio broadcast, the Khmer Rouge announced they plan to abide by a UN peace plan despite the near lynching of Khieu Samphan, the organization's nominal leader, by a revenge-seeking mob in Cambodia.""",0
89,23136784,1821,"The youths then beat the man on the head and upper body with bottles and their fists, took $25 from him, slit his pants with a razor and sexually assaulted him with a stick, the police said.",1
90,23141748,1711,"But in interviews, other intelligence officials were willing to verify only that the Government intercepted communications of Sandinista officials discussing among themselves their private contacts with Congressional officials.\n\n\n\nAt one point some Administration officials proposed that members of Congress or their aides be prosecuted, former Administration officials said.",0
91,23160153,1823," the Yonhap news agency said.\nIn the southern industrial city of Masan, 100 protesters were watched by more than 15 times as many riot policemen.\nAnti government demonstrations have erupted across South Korea since five riot policemen allegedly beat to death a 20-year old student, Kang Kyung-dae, during a demonstration in Seoul on April 26.",1
92,23161900,186,"Authorities blame much of the city's violence on rivalry between youth gangs working for the Medellin cartel.\n\n\nIn the second shooting, gunmen killed a town councilman and five peasant leaders traveling 50 miles northwest of Bogota, the police said.""",1
93,23171114,1823,"\n\nBut this time, he said he was being lynched by a committee of the United States Senate rather than """"hung from a tree.""""\nUnder questioning tonight from Senator Heflin, Judge Thomas said he did not watch Professor Hill's testimony because he could not bear to watch untruths.\n""""If you did not listen,"""" Senator Heflin said, that made it difficult """"to find out what the actual facts are.""""",0
94,23199217,1821,"""A Manhattan federal appeals court on Jul 28, 1992 criticized the New York City Police Department for its apparent discrimination against Karen Sorlucco, who had charged another officer with raping her at gunpoint in 1983.",1
95,23225526,1724,"""In the wake of the first outbreak of ethnic fighting on Russian soil on Oct 30, 1992, Russian President Boris Yeltsin declared a state of emergency in North Ossetia and Ingushetia on Nov 2, 1992.""",1
96,23225526,1724,"""In the wake of the first outbreak of ethnic fighting on Russian soil on Oct 30, 1992, Russian President Boris Yeltsin declared a state of emergency in North Ossetia and Ingushetia on Nov 2, 1992.""",1
97,23264928,185,"The action was taken in retaliation for an attempt by Iraq to assassinate former President George Bush.""",1
98,23264958,185," Madeleine K. Albright,said United States retaliation was consistent with Article 51 of the United Nations Charter, which provides for the right of self defense, for what American officials have concluded was a plot by the Iraqi Government to assassinate former President George Bush in Kuwait.",1
99,23276597,1712,"The baby was a second child, a boy, and the parents did not wait the four years before a second child is allowed in this area.\n\nInstead, the baby was born five months before the time limit, so the local authorities destroyed the home and took the cow.",1
100,23286164,185,"""A Kuwaiti court said on Dec 25, 1993 that it would re-examine a prosecution witness and possibly some defendants in the trial of 11 Iraqis and 3 Kuwaitis accused of plotting to kill former President George Bush.""",1
101,23294877,185,"""According to an article written by Seymour M.  Hersh and published in the New Yorker, the evidence of an Iraqi assassination plot against former President George Bush was much weaker than the Clinton administration asserted, with no evidence directly linking Iraqi President Saddam Hussein, his intelligence service or his senior advisors to the conspiracy.",1
102,23471351,1724,"Lawton Chiles had declared a state of emergency for the northwest and central Gulf Coast regions of the state on Sunday, which put the state's National Guard on standby, and gave today off to state employees in 11 Panhandle counties.",1
103,23477040,185,"When the United States uncovered what it said was an Iraqi plot to assassinate Mr. Bush, Mr. Clinton ordered the bombing of an Iraqi military intelligence headquarters in Baghdad in 1993.",1
104,23486126,1711,"\n\n\n\nThe Government has made this group the focus of its public campaign, likening it to the now-defunct Indonesian Communist Party, which was blamed for an attempted uprising in 1965 that touched off a wave of violence that took up to 500,000 lives and led Suharto to seize power from Sukarno in a military coup.\n\n\nMr.",0
105,23491577,1711,"For one thing, no one was meant to know Mrs. Peabody's death was an assisted suicide.\n\n\n\nA week later, however, police officers raided a hotel room in suburban Detroit in which Dr. Kevorkian and Mrs. Good were meeting with another woman, and seized items, including a videotape of Mrs. Peabody discussing her condition and asking Dr. Kevorkian to help her die.",1
106,23494950,1823,"Instead, the guards at the jail, then situated in Jersey City, beat him to death with their fists and a fiberglass baton.",1
107,23500447,1724,"Mr. Rowland said the results were expected and were not a cause for alarm.\nAfter Gov. Lincoln Almond of Rhode Island had declared a state of emergency in Westerly, Connecticut started using trucks to spray insecticide around swampy areas in Stonington and North Stonington.\n\nOn Long Island last month,",1
108,23500902,182,"But to beat the Democratic nominee -- likely to be either Norm Rice, the Mayor of Seattle, or Gary Locke, the King County Executive -- Republicans first have to end their own war.",0
109,23506169,1822,"""An international human rights delegation  here this week heard new testimony from a witness who said he saw Mexican soldiers in a rural church in  Chiapas state torture three young farm boys who later were found dead along a highway.\nIn Mexico City, a stream of citizens told the delegation about police officers' using torture while carrying out criminal investigations.\n\nAnd in the turbulent state of Guerrero, the delegation from the Organization of American States got a taste of the harrassment that human rights monitors endure routinely in many parts of Mexico.",1
110,23507977,1821,"Gordon then shot Ms. Mauzon in the head, forced the other women to remove their clothes and sexually assaulted them, eventually slashing Zakkiyhah Holliman, 18, to death and bludgeoning her twin, Hadiyah, with a hammer, the police said.\nThe police said their account was based on interviews with Latisha Crite, 19, who fled by jumping from a window.",1
111,23517569,1821,"But the law would make untenable the defense that 14 years ago freed James L. Morrow, a former corrections officer accused of raping an inmate at Bedford Hills.",1
112,23517569,1821,He said a deputy warden and a corrections officer at the women's prison in Niantic were charged recently with sexual assault of the same inmate.,1
113,23527217,1822,"Is there any place like this?"""" \n&lt;umient&gt;\n&lt;uopts&gt;&lt;ety&gt;39&lt;/ety&gt;&lt;enum&gt;0&lt;/enum&gt;&lt;/uopts&gt;&lt;photo&gt;\n Nita, a 56-year old teacher at a refugee camp, says: """"My parentstold me how Burmese soldiers tortured the Karen people.",1
114,23527647,1821,The woman told the police that she was raped by two male inmates  when she was changing clothes to leave the jail.,1
115,23539626,1822,"Many of these Mexicans were detained under suspicion that they had collaborated with anti government guerrilla groups.\n\n\nThe group has also recorded a sharp increase in reported cases of people tortured by the police or the military to obtain confessions in criminal investigations, and of people who disappeared after being detained by the authorities.\nMexican officials ''showed their lack of interest in the perspective of a human rights organization which contradicts official wisdom,'' Mr. Sane said of his reception here.\n\nParadoxically,",1
116,23540019,185,"""A Federal judge who was to sentence a Mafia figure removed himself from the case this week after prosecutors said the defendant had admitted plotting several years ago to kill the judge.\n\nThe judge, Eugene H. Nickerson of Federal District Court in Brooklyn, stepped down on Monday from the case of Anthony S. Casso after receiving a letter on Friday from a prosecutor who said that when Mr. Casso agreed in 1994 to cooperate with the Government,",1
117,23542728,182,"\n\n\nA dedicated athlete with a confessed weakness for the pleasures of the world, he beat a Greek for gold in Atlanta, and then kissed his rival as a public call for friendship between edgy neighbors.",0
118,23567161,1821,"""A former high school track coach was arrested today in connection with the rape of a Chabot College student, one of a series of attacks in the San Francisco Bay area attributed to a serial rapist.\nThe suspect, Tony Lawayne Ransom, 47, of San Leandro, was arrested at his home, the police said.\nMr.",1
119,23570994,1711,"Two weeks ago, police raided 10 video stores in Suffolk County.\n\n\n\n''In the final analysis, it's out-and-out theft, and can not be tolerated,'' said Mr. Pistey of the association.",1
120,23577059,1822,"noted that the most damaging information was based on statements made by a Palestinian who subsequently claimed he had been tortured by Israeli interrogators and was forced to sign a confession in Hebrew, which he could not understand.\n\n\n\nThe Israeli Government's apparent reluctance to bring Mr. Abu Marzook to trial appeared to contradict Mr. Netanyahu's reputation as a hawk in the fight against terrorism.",1
121,23579147,1712,"On Dec. 12, 1981, she said, soldiers broke down the doors of the family home, beat her father with rifle butts when he resisted and sexually assaulted her 10-year old sister until the father surrendered.",0
122,23579400,1711," said that the agency would be reviewing the records it seized from locations ''directly or indirectly connected to the Columbia health care system'' in the coming weeks.\nAmong the thousands of documents the Government seized was one that appears to demonstrate an aggressive approach by the company toward gaining the most money possible from Medicare.\n\nThe document, from Columbia Medical Center West,",1
123,23584120,1822,"There were signs that his assailant had tortured him and spent time in his town house.""",1
124,23592676,185,"""Three suspected Basque separatist guerrillas went on trial in Spain's high court today, accused of plotting to kill King Juan Carlos in 1995.",1
125,23599154,1724,"Pete Wilson, who toured the stricken area around Monterey today, has declared a state of emergency in 22 of California's 58 counties, most of them in the Sacramento Valley and along the coast north of Monterey.",1
126,23600197,185," would not discuss Mr. bin Laden's legal status nor would he comment on reports that the indictment accused Mr. bin Laden of plotting to kill President Clinton in 1994 during a visit to the Philippines.\n\n\n\nMr. al-'Owhali first emerged as a possible suspect when Kenyan authorities contacted him two days after the bombing in Nairobi, according to a Federal complaint signed by an F.B.I. agent, Daniel J. Coleman.",1
127,23609021,1823," barbecues and other outings for children.\n\n\n\nAnd as prosecutors prepared to seek a second-degree murder charge against the suspect -- a 17-year old who was paroled in April after serving only two years for beating a homeless man to death when he was 15 and who is charged with killing another man two weeks ago -- there were expressions of outrage at City Hall.\n\n\n\nMayor Rudolph W. Giuliani noted at a news conference that Officer Carter, the son of a police officer, had a record of commendations and 76 arrests, and that the suspect,",1
128,23613001,1823,"The Atlantic County Prosecutor, Jeffrey Blitz, said the second skull had not been identified.\n\n\n\n  Ernest Ireland, 51, has been charged with beating Mr. Dallman to death and burying him in the basement.",1
129,23614872,1821,"\n\n\nMaureen Kanka, who campaigned for the law after her 7-year old daughter Megan was raped and murdered by a paroled convict in her neighborhood in 1994, said at a seminar on child abuse today that swift and full prosecutions will reduce harassment of parolees.\n\n\n''I",1
130,23618019,1712,"\n\n\nIt was the word of a confidential informer who spoke of drugs and guns that led a team of police officers to break down the door of an apartment in Crown Heights, Brooklyn, on May 1.",0
131,23618188,182,"""The unseeded American Vince Spadea reached his first ATP final yesterday, beating the defending Raiffeisen Grand Prix champion, Marcelo Filippini, 6-3, 6-0.\nIn today's final in St. Poelten, Austria, Spadea, ranked 62d in the world, will face top-seeded Marcelo Rios for the title.",0
132,23620424,1712,"Officials later said they had hit the wrong apartment.\n\n\n\n*That same day, the police broke down the door of another Bronx apartment, only to find an 18-year old woman who was eight months pregnant napping with her two children.",0
133,23643554,1823,"Then in 1968, Red Guards called her husband a ''capitalist roader'' and beat him to death, she says, leaving her and their three children penniless.\n\n\n\n''I am not asking for another life in return for the life of my husband,'' she said, clutching her husband's army discharge card and a stack of tattered letters from offices that denied they had jurisdiction.",1
134,23651567,182,"Instead, the indictment charged, he raped and sodomized her and then fatally shot her in the head.\n\nThe indictment charged that Mr. Gordon then went to a second-floor apartment and fatally shot two women, Mary Mouzon, 33, and Hadiyah Holliman, 18, and beat Ms. Holliman's twin sister, Zakkiyah Holliman, with a hammer.",0
135,23653242,1821,"Civil rights and minority groups had expressed concern about stepping up a police presence because of often-strained relations among young minority students and police officers.\n\n\nBut the Division of School Safety has been the subject of no fewer than seven investigations since 1971 by the board, city and outside auditors, all of which found lapses in training, recruitment and discipline.\nOver the years, there have been several incidents in which safety officers have been arrested on charges of sexually assaulting students or possessing drugs.\nA high-ranking school administration official said there were no plans to dismiss any of the current safety officers,",1
136,23655106,1724,"''They are using the villagers as weapons in their struggle,'' he said, ''and it is very dangerous.''\n\n\n\nIndonesia's generals have seized on the Free Aceh Movement as a justification for Indonesia to impose martial law in the province.",1
137,23659127,1823,"The bronze statue in East London of Steve Biko, the anti-apartheid activist who was beaten to death by the police in 1977, is widely acknowledged to be a nice idea, dreadfully molded.\n\n\nThe statue of the new Mayor of the little dorp of Wepener, put up to counterbalance the old one of the brutal 19th-century Kommandant Louw Wepener,",1
138,23660844,182,"Later, though, he told reporters he supported an inquest jury's conclusion that the shooting had been accidental.\n\n\n\nIn 1998, he told a columnist for The Seattle Post-Intelligencer that as a young police officer in San Diego, he had beaten up gays and used racial slurs to harass members of minority groups.",1
139,23669603,1822,"""A federal prosecutor held yesterday that the police officer who tortured Abner Louima deserved no mercy and should be sentenced to life in prison without the possibility of parole.\n\nCalling the incident ''one of the most serious nonlethal acts of police brutality in the history of New York City,'' the prosecutor denounced as ''reprehensible'' the initial suggestion of the officer, Justin A. Volpe, and his lawyer that Mr. Louima had suffered his severe internal injuries during a homosexual act.\n\n\nArguing in court papers for the maximum penalty,",1
140,23673222,1821,"""The mother of a 13-year old boy who says he was sexually assaulted by a Yale professor has sued him, the university and the New Haven Board of Education.\n  The suit claims that Antonio Lasaga, a geology professor, abused the boy while mentoring him in a New Haven public school program.",1
141,23673906,1711,"Feerick was convicted of unlawful imprisonment, trespassing, official misconduct and coercion for her role in a 1990 incident in which she and several officers under her command raided two East Harlem apartments.",1
142,23686162,1821,"''Albanian criminal gangs go over to burn Serbian churches and the roots of our religion, raping Serbs and kidnapping them and burning their houses.",1
143,23693050,1822,"Like Justin A. Volpe, the officer who on May 25 admitted torturing Abner Louima, Mr. Schwarz could face life in prison.",1
144,23705775,185,"""A Federal judge here in the trial of seven Cuban exiles accused of plotting to kill Fidel Castro has reversed a ruling he made in January to move the trial to Miami and instead has ordered the proceedings to continue in Puerto Rico.\n\nLawyers for the defendants, six of whom own homes in the Miami area, said today that they regarded the ruling, made Monday by United States District Court Judge Hector M. Laffitte, a setback.",1
145,23728535,1711,"Kim Dong Jin joined the North Korean Army after being jailed several times for his Communist beliefs.\nThe South Korean Army then threw his father into prison because of his son's activities and confiscated all of the family's possessions, Kim Dong Man said.",1
146,23749404,1712,"The objects of Aslan's desire are Russians, especially those Russian soldiers who destroyed his home this winter in the village of Urus-Martan.\n\nRussians have no monopoly on horror in this harrowing conflict.",1
147,23755272,185,"""The key witness in the trial of a man charged with plotting to kill a state judge testified yesterday that his own life as a career criminal was intricately intertwined with work as a government informer, passing information in exchange for leniency.\n\nThe witness is a jail-house informant,",1
148,23767317,1821,He also faces charges in State Superior Court that he sexually assaulted a 13-year old New Haven boy whom he had taught as part of a mentoring program.,1
149,23771616,1712,An agitated man said Russian artillery strikes had destroyed his home.,1
150,23787688,1822," it was disclosed that it contradicted the testimony of Detective Eric Turetzky, the government's chief witness in the infamous brutality case.\n\nThe emergence of the document created such a flurry because Detective Turetzky was the factual cornerstone of the government's claim that Mr. Schwarz led Mr. Louima into a police station bathroom, where another officer eventually tortured Mr. Louima with a broken broomstick.\n\n\n\nAccording to people briefed on the evidence in the case,",1
151,23788831,1822," while usually only lightly punishing those whose abuse goes too far.\n\n\nThe two policemen who tortured Mr. Du into confessing were sentenced last month to suspended one-year and one-and-a-half year sentences respectively.\nCompounding the problem is an untrained and politically beholden judiciary.\nJudges in China are not required to have any legal training, and few do.",1
152,23794332,1823,"The kidnappers said last week that they had beheaded Mr. Sobero, who is from Corona, Calif.\nThe other two Americans, a missionary couple from Wichita, Kan., Gracia and Martin Burnham, were still in captivity but are believed to be alive.",1
153,23801825,1822,"""Settlement talks in Abner Louima's federal lawsuit against the city and the police union have stalled, and a judge has postponed a conference in the case scheduled for today, according to court papers and people familiar with the case.\n\nSeveral lawyers involved in the civil rights case filed by Mr. Louima, who was tortured by a police officer,",1
154,23812212,186,"He and his family were assassinated at the palace during a coup in 1978 by soldiers loyal to Taraki.\n\n\n1978\nNOOR MOHAMMAD TARAKI\n\nKnown for being cruel and crude, he lasted about a year until he was assassinated by being suffocated to death on the orders of his vice president.",1
155,23817693,1821,"""A high school student here has been accused of sexually assaulting a classmate -- an awful allegation for any community, but particularly for this suburban enclave, which is still smarting over a highly publicized assault case more than a decade ago.\n\n\nIn 1989, bucolic Glen Ridge, where every street is graced by a gas-fueled lamplight, was rocked when a mildly retarded 17-year old girl was sexually assaulted by a group of Glen Ridge High School athletes.",1
156,23837729,1821,Mr. Trump said he wanted the ''criminals of every age'' who were accused of beating and raping a jogger in Central Park 12 days earlier ''to be afraid.'',1
157,23837986,1712," in dealing with the so-called Caroline Incident in 1837 when British troops attacked and sank an American ship, the then Secretary of State Webster made a point that an intrusion into the territory of another state can be justified as an act of self defense only in those ''cases in which the necessity of that self defense is instant, overwhelming and leaves no choice of means and no moment of deliberation.''",1
158,23843674,1821,"""A Roman Catholic priest was arrested yesterday in Texas on charges that two years ago he raped a woman on a couch in a Brooklyn rectory, where she had gone for advice about annulling her marriage, the authorities said.\n\nChurch officials in Brooklyn did not notify law enforcement officials of the woman's accusations against the priest, the Rev. Cyriacus Udegbulem, in 2000, and instead encouraged her to do so herself, a church spokesman said yesterday.",1
159,23843992,186,"There is also talk of creating a parliament or assembly to include more groups in the government.\n\n\nSome critics have complained that Mr. Karzai's government has been slow in confronting regional warlords and tracking down officials who assassinated a government minister this winter.\nBut if Mr. Karzai can deliver stability,",1
160,23850893,1712,"Food, water, electricity and ambulances have been blocked from the area for five days, Palestinian officials said.\n An Israeli human rights group said that Israeli forces have demolished Palestinian homes, including several with people still inside them, though that could not be verified.\nIsraeli military officials said missile attacks and bulldozers had destroyed homes from which Palestinian gunmen had fired on them, but they said that megaphones had been used to warn civilians.\n\nIsraeli officials said they have repeatedly asked surrounded Palestinian gunmen to lay down their arms and offered civilians opportunities to leave.",1
161,23854209,182,"''I wanted others to feel the awe I felt watching these workers,'' Mr. Garcetti said.\n\n\n\nDuring his eight years as Los Angeles district attorney, Mr. Garcetti was involved in the prosecution of O. J. Simpson and the aftermath of the trials of the officers accused of beating Rodney King.",1
162,23858834,182,"He went on to beat James J. Florio, then a young congressman, by 1,797 votes, said to be the narrowest margin on record.\n\n\nAs governor, Mr. Kean demonstrated that his Republicanism was more a matter of birth and tradition than of ideology.",0
163,23862505,182,"On the main thoroughfare in Minsk, the capital, riot police beat protesters with truncheons as they sat or kneeled on the pavement.",1
164,23865062,186," intelligence and military officials.\n\n\n\nIndeed, some senior advisors to Mr. Rumsfeld say a legal finding allowing lethal force to be used as part of a mission against a terrorist leader may not be necessary to send Special Operations forces to hunt, capture or kill Al Qaeda leaders in any country -- especially since the terror network attacked the United States on Sept. 11, creating a state of armed conflict.\n\n\n''We are at war with Al Qaeda,'' a senior advisor to Mr. Rumsfeld said.",0
