,aid,code,text,correct
165,23869905,1711,"""THE Suffolk County police officers who raided the Rainbow massage parlor in early August thought they would be able to shutter the Coram establishment for good by arresting three women on prostitution-related charges and carting away several makeshift beds, 47 condoms and $2,350.\n\n\n\nBut the massage parlor, operating in an old television repair shop with no sign advertising its more arcane business, was up and running again less than a week later at its usual busy commercial intersection, opposite a Home Depot on Route 112.",1
166,23878274,186," Nasr Jarrar, was holed up, to pass on a demand that he surrender.\n\n\n\nThe 19-year old youth, Nidal Abu Mohsen, was shot dead approaching the house -- each side accused the other of shooting -- and the Israelis blasted the house, killing the Hamas leader in the rubble.",1
167,23878858,1711,"At the time of his arrest, the police raided his apartment in southeast London and found a laptop computer containing articles about Al Qaeda and Osama bin Laden.\n\nOn his Website, Mr. Zain-ul Ibidin advertised a company called Sakina Security Services, which offered a two-week military-type training course in the United States.",1
168,23882070,1712,"The seven men were not Pakistanis, he said.\nHundreds of Pakistani troops continued to sweep the area around Wana, in the Pakistani tribal area of South Waziristan, for a group of Al Qaeda suspects believed to number about 35.\n\nOfficials said that Pakistani troops destroyed the home of a tribal elder suspected of providing shelter to the suspected militants.",1
169,23884652,1821,"He is accused of raping the student twice, once at Newton High School in Elmhurst in December and once near Forest Park in March, said Detective Cheryl Cox.",1
170,23891790,1821,"He detained Mr. Gauthe over a new accusation that back in the 1980's, the priest had raped a 12-year old sister of one of his altar-boy victims.\n\n\n\nLater, though, the state and the defense discovered a long-forgotten provision in Mr. Gauthe's plea bargain: immunity against further complaints on acts that had occurred before 1985.",1
171,23893284,182,"They know where he lives, and, after Mr. Lewis beat up a mugger who he said was sent by the dealers, they probably know that the bald man with the bulging eyes and graying beard also holds a second-degree black belt in jujitsu.",1
172,23895777,182,Two lower-ranking secret police officers were given three year jail terms for beating dissidents under the same plan.,1
173,23899670,1822,"All three, they said, were members of Jaish-e-Muhammad.\n\n\nThe teenager from the village ran off and joined Jaish-e-Muhammad after his father and older brother were arrested and tortured by the police, something that human rights groups say happens with alarming frequency.\n\nHis father, Abdul Sattar Khan, said his son had left without any explanation.",1
174,23907226,1724,"Hundreds of thousands of trees are estimated to have died, making them easy to burn.\n\n\n\nBecause of the bark beetle infestation, Gov. Gray Davis declared a state of emergency in March in San Diego, Riverside and San Bernardino Counties, easing regulations to allow property owners in those Southern California areas to more quickly remove dead and dying trees.\n\n\n\nThe United States secretary of agriculture,",1
175,23907472,1711,"The documents, which detail mass killings at Saddam Hussein's behest, were obtained by Kurdish militia fighters who raided the offices of military and Baath Party security officials in the northern cities of Erbil, Kirkuk and Sulaimaniya.\n\n\nIn addition, Indict, a London-based group,",1
176,23919706,1712,"\n\nRed Crescent minivans, manned by young women in white smocks and head scarves, traced the route of Sunday's battle, picking up the bodies of fallen Iraqi fighters.\nAlong the Shatt al-Arab waterway on the east side of the city, British troops broke down the doors to one of Mr. Hussein's palaces, empty except for carved teak, marble floors,",0
177,23921088,1712,"It may also have cost him his life.\n\n\n\nSince Mr. Djindjic was shot outside his office on Wednesday, the police have detained more than 180 suspects for questioning and destroyed the house of the leader of a Belgrade gang linked to the assassination.",1
178,23924990,1711,Public security officials searching her family's home seized Ms. Liu's computer and some floppy disks.,1
179,23930091,182,"''We need to beat them and beat them soon, or they are going to keep growing and getting stronger until they eventually beat us,'' Senator Gill said.\n\n\nState Senator Sharpe James, who is also Newark's mayor, said gangs were a statewide problem and called for more coordination of antigang policies among law enforcement agencies.\n\nAfter the news conference, Ms. Dow announced that 10 inmates at the jail annex had been charged with murdering the robbery suspect, Lamonte Gallemore of Newark, by beating him during an initiation into a street gang known as the Crips.",0
180,23930581,1712,"Relief workers in Gaza say soldiers have demolished dozens of Palestinian homes in Rafah during the last nine days.\n\n\nAn F.B.I. investigation continued Saturday into a bombing in Gaza on Wednesday that killed three American guards riding in a diplomatic convoy.\nIt was the first deadly attack on an official American mission in the Palestinian areas.\nPalestinian security officials said they had arrested a total of 10 people in connection with the bombing.\nThe suspects include four members of the Popular Resistance Committees,",1
181,23937326,1724,"The more serious issue is why the system's computers and human operators failed to isolate and limit the trouble.\n\nWill a precise cause be determined anytime soon?\nIt could take weeks.\nWho was hit the worst?\nProbably Detroit and Cleveland.\n\nPower was so slow to return in Detroit that on Friday Gov. Jennifer M. Granholm of Michigan declared a state of emergency in five counties, and sent thousands of gallons of water and gasoline to the city, along with state police officers and some National Guardsmen.\n\n\n\nGov. Bob Taft of Ohio declared a state of emergency in Cuyahoga County,",1
182,23942340,1712,"""Early on a Wednesday morning in May, officials from two law enforcement agencies broke down the door to an apartment of a frail man, Timothy Brockman, threw a stun grenade inside -- setting a carpet on fire -- then ordered him out of bed and handcuffed him as he lay face down.",0
183,23945447,1822,"The asylum seeker, Abas Amini, 33, a dissident and poet, spent six years in Iranian jails and was repeatedly tortured before coming to Britain in 2001.",1
184,23949205,186,"But Tutsi extremists assassinated the new president four months later.\n\n\n Credit: AP""",1
185,23953568,185,"""A group of white right wing South Africans who face many charges of terrorism and treason were accused yesterday of plotting to assassinate former President Nelson Mandela.",1
186,23961369,1821,"Despite the pressure on bishops over the last year to reveal the extent of the abuse, some refused to release the number of accusations or the names of the accused priests.\n\n\nDECADES OF DAMAGEThe Sexual Abuse Scandal&lt;break/&gt;\n\n&lt;umient&gt;\n&lt;uopts&gt;&lt;ety&gt;39&lt;/ety&gt;&lt;enum&gt;0&lt;/enum&gt;&lt;/uopts&gt;&lt;abstext&gt;\n\n Richard K. O'Connor says he was raped by three priests when he was 10.",1
187,23969061,186,"He got into film after he was pitched by Jason Kliot and Joana Vicente, the presidents of Open City films, to finance a movie starring Sean Penn, ''The Assassination of Richard Nixon''; Mr. Deutsch passed, the film was made (it will be released this year), and, feeling that he had let an opportunity go to waste, he joined forces with the company, taking on the role of angel investor.",0
188,23980057,1724,"""President Olusegun Obasanjo declared a state of emergency in the central state of Plateau on Tuesday, suspending its elected officials and putting a retired general in charge of a region racked for months by sectarian violence.\nOn state radio and television, Mr. Obasanjo accused Plateau officials of having ''wittingly and unwittingly encouraged acts that have subverted peace and tranquility.''",1
189,23981957,1821,"""Prosecutors suddenly dropped charges against two Montclair High School football players accused of raping a schoolmate because they concluded that the sex was not forced or violent but consensual, people with knowledge of the case said yesterday.\n\nIt is not clear if the girl, a 15-year old sophomore, recanted her replacementinal charge that the boys kidnapped her and forced her to have sex in the back of a car,",1
190,23987876,185,"South of the capital, near the Euphrates River, a volley of mortar fire struck a Marine base on Monday afternoon, wounding 13 marines and two civilians, military officials said.\n\n\n\n In Najaf, the Shiite holy city south of Baghdad, American and Iraqi forces arrested the deputy governor of the province along with 30 other Iraqis and charged them with plotting to kill the American-installed governor, police officials said.",1
191,23994712,1712,"Israel destroys the houses of Palestinians involved in violence, saying it serves as both punishment and a deterrent to future attacks.\nThe Palestinian Authority, headed by Yasir Arafat, condemned Wednesday's bombing, though Al Aksa Martyrs Brigades, a group loyal to Mr. Arafat, claimed responsibility for the attack.\n\nThe relationship between Al Aksa and Mr. Arafat's Fatah movement has been somewhat murky.",1
192,23997029,185,"In August, the group claimed to have carried out an attempt to assassinate Shaukat Aziz, then Pakistan's prime minister-designate; the attack killed eight people but left Mr. Aziz unhurt.\n\n\n\nThe bombings have occurred on either end of Sunday's presidential election in Chechnya, which has proved to be another ambiguous milestone in the war.",1
193,23998801,185,"But it remains a delicate relationship; the United States has not sold the Pakistanis the additional F-16 fighter jets it had promised and the Pakistanis have not allowed the Americans to directly interrogate Abdul Qadeer Khan, the father of the Pakistani nuclear program, who has acknowledged that he shared nuclear technology with Iran, North Korea and Libya.\n\n\n\nTwo assassination attempts against Pakistan's president, Gen. Pervez Musharraf, last year may have also played a role in that country's cooperation with the United States.",1
194,24003973,1823,"He said the soldiers were taking revenge for the beheading of an Afghan soldier and translator by Taliban fighters in the Arghandab district, the scene of recent heavy fighting.\n\n\nOn Wednesday, the A.P. and Reuters reported that Mr. Tokhi had retracted his account.",1
195,24005155,182,"Sharapova Defeats Golovin\nMariya Sharapova of Russia won her first singles title of the year yesterday, beating Tatiana Golovin of France, 4-6, 6-2, 6-1, in the final of the grass-court DFS Classic in Birmingham, England.\nSharapova had four double faults and was broken twice in the first set.",0
196,24017364,182,"\n\n\n\nAs was the case in Iowa last week, surveys of voters leaving the polls here suggested that they chose Mr. Kerry more for his electability than for his compatibility, with 46 percent of his supporters saying they voted for him because he was the best candidate to beat Mr. Bush, compared with 42 percent who said he shared their views on the issues.\n\n\n\nOne in five voters said electability was the quality most important to them, and 60 percent of those chose Mr. Kerry.",0
197,24027069,185," 1919 Connecticut Avenue NW, (202) 483-3000, www.hilton.com, is referred to as the Hinckley Hilton (to distinguish it from the dozen other Hiltons in the Washington area) for being the site of John Hinckley's assassination attempt on President Ronald Reagan in 1981.",1
198,24027447,1712,"Or they could go to one of the 24 resettlement camps that the government has started to build for some of the displaced.\nBut the notion of large numbers of people in close quarters guarded by soldiers raises sour memories -- and some real fear -- in the Aceh region of northwestern Sumatra, where the government has fought an insurgency for nearly 30 years.\n\nIn various phases of the long-running civil conflict, the government has herded people into relocation camps, often after houses were destroyed by the army.",1
199,24032552,1711,"\n\n&lt;umient&gt;\n&lt;uopts&gt;&lt;ety&gt;39&lt;/ety&gt;&lt;enum&gt;0&lt;/enum&gt;&lt;/uopts&gt;&lt;abstext&gt;\n\n Peter J. Criscuolo Jr., a state marshal, accompanies tow trucker drivers and tax collectors as they peruse streets for tax offenders.; New Haven is seizing the cars of drivers who owe motor vehicle taxes, by scanning license plates with a radar gun-type device.",1
200,24035919,186,"Mr. Nichols, who the police say killed a judge, a court reporter and a deputy sheriff at the courthouse on Friday and an off-duty federal customs agent later, gave up peacefully.\n\n\n''I honestly think when I looked at him that he did not want to do it anymore,'' Ms. Smith said in a statement broadcast Sunday evening on CNN.\nMs. Smith said Mr. Nichols took her hostage outside her apartment when she returned from a store about 2 a.m.",1
201,24046550,1823,"One episode was about an American police officer who stabbed his girlfriend to death and set a fire to cover it up.\n\n\n\n''It was pretty dramatic,'' said Paul DiMartino Jr., president of Milky Way.",1
202,24047881,1821,"The scandal that erupted in 2003 prompted several investigations, the ouster of the school's four top commanders and new policies.\n\n\nA separate court martial was under way on Saturday at the academy for a senior cadet accused of raping another cadet while on a diving club trip last year in New Mexico.\nWitnesses testified at a preliminary hearing in November that the senior cadet, Benjamin Kuster, said he was drunk and may have mistaken the woman for his girlfriend.",1
203,24049709,186," who cooperated with the Israelis' invasion in 1982 and was elected president behind their tanks.\n\n\n\nThe assassination of former Prime Minister Rafik Hariri in February set off the tumultuous chain of events -- including rallies calling for an end to Syrian occupation that eventually drew a million and a half Lebanese across religious divides -- that forced the Syrian president, Bashar al-Assad, to end his country's 29-year occupation.",1
204,24054445,1724," Mahmoud Abbas, and his interior minister, Nasser Youssef, declared a state of emergency in Gaza and ordered security services to stop Hamas and Islamic Jihad from firing on Israelis.\n\n\n\nMr. Abbas, who is in Gaza for talks with militant factions and to oversee the period before the Israeli pullout of its settlers from the strip in mid-August, is under increasing pressure from Israel and the United States to put an end to attacks against Israeli civilians.\n\n\nMr.",1
205,24055174,1823,"""Israel's Parliament on Wednesday easily voted down three bills aimed at delaying the withdrawal of Jewish settlers from the Gaza Strip, while in southern Israel, for the third straight day, security forces prevented pro-settlement demonstrators from marching on Gaza.\n\n\nLate on Wednesday, Reuters reported that a Palestinian boy had been stabbed to death by Israelis in the West Bank, citing reports from unidentified Palestinians.\n  The boy was taken to Rafidiah Hospital in Nablus, and Dr. Musa Alayan,",1
206,24057107,1822,"""The Egyptian police fatally tortured 22 prisoners in 2004, a marked increase from the 8 prisoners reportedly tortured to death a year earlier, according to a report by the Egyptian Organization for Human Rights.",1
207,24059856,1724,"\n\n\n&lt;/abstext&gt;\n&lt;/umient&gt;&lt;umient&gt;\n&lt;uopts&gt;&lt;ety&gt;37&lt;/ety&gt;&lt;enum&gt;0&lt;/enum&gt;&lt;/uopts&gt;&lt;abstext&gt;\n ''Illegal Crossings''\nEarlier this month, Gov. Bill Richardson declared a state of emergency in the southern New Mexico counties of Hidalgo, Grant,",1
208,24061940,185,"There were also unconfirmed reports that the son of Anbar Province's governor had been kidnapped from his college.\n\n\n\nIraqi officials say Mr. Hussein's first trial is expected to begin Oct. 19, when he faces charges that he ordered the killing of nearly 150 men and boys from the Shiite village of Dujail, 35 miles north of Baghdad, after a failed assassination attempt against him there in 1982.\n\n\n\nIf convicted, Mr. Hussein could be hanged soon afterward, eliminating the need for other prosecutions of charges of crimes against humanity, Iraqi officials have said.",1
209,24066113,1712,"Paramilitary forces demolished countless homes there in May and June, and Mr. Rose said the police were now rousting people from shopping centers and even from homes where they had been quietly selling goods to passers-by.\n\n\n\n''On Tuesday there came some police constabularies,'' he said.",1
210,24077519,1711,The proposal would also allow the authorities to seize some assets of those convicted of such a crime.\n\n\n\nProponents of the legislation have argued that such provisions would make it harder for illegal immigrants to thrive in the United States by discouraging people from helping them.,0
