,aid,code,text,correct
0,2707204,186,"""""At the end, the hospital and the Glen became the same project for us,"""" Mr Petitto said.\n\nThe filmmakers also interview Ahmed Shah Mas soud, the """"lion of Panjshu; ' a  leader killed on Sept. 9 by assassins believed to be associates of Osama bin Laden.",1
1,22343849,1724,"\n\n\n     Mayor David Crosby declared a ''full state of emergency'' in the city, which  is 30 miles south of Boston.",1
2,22345694,186,"After a sharp rise in the number of North Korean-inspired incidents on the border in 1967 and 1968, an attempt to infiltrate guerrillas into Seoul to assassinate President Park Chung  Hee of South Korea and years of increased military spending, the North Koreans changed their military strategy.",0
3,22356406,1711,"\n     In a separate development, Afghan authorities said that Afghan and Soviet soldiers killed ''an American military advisor'' in the southern part of the country near the Iranian border, confiscating his camera and films.",1
4,22357946,182,"\n\n\n\n     According to the indictment, at least six Mexicans and a 16-year old American  citizen also were beaten by Mr. Wood and Mr.  Barker.",1
5,22365413,1823,"""Winston G. Martin, 24, of 2131 Clinton Avenue, the Bronx, a porter at the Gimbels department store on East 86th Street, was arrested after two alarms went off as he allegedly hid in a basement room with a Gimbels shopping bag containing $16,300 worth of gold pendants and chains that had been taken from a  display case. ... Harold Utsey, 32 years old, of 101 East 119th Street was stabbed to death when he resisted a male-female robbery team while he sat on a bench with a female friend at Franklin D. Roosevelt Drive and 116th Street.",1
6,22367891,1822,"\n\nIn ''Sus,'' a harrowing one-act play that is making the rounds of fringe theaters in London, a black man is harassed and tortured in the back room of a police station by two white detectives investigating a murder of which he is wholly innocent.",0
7,22371348,185,"\n\nEleven of those accused of plotting to kill Mr. Marcos, his wife, Imelda, and six Cabinet ministers appeared at a suburban military camp.",1
8,22387478,186," holly and magnolia leaves, a tree decorated with ornaments from every state in the union, wreaths made of seashells by fifth graders in New Jersey and, in the state dining room, a traditional gingerbread house made of chocolate cookies, candy canes and a special Reagan touch - a path of jelly beans leading to the front door.\n\n\n\nThe festive mood was dampened when Mrs. Reagan was asked about reports that a squad of Libyans had been sent to assassinate her husband and other officials.",0
9,22394679,185,"Mr. Burns was captured after his 9-millimeter gun jammed.\n\nIn 1969, Mr. Burns was one of 21 persons charged in an indictment with plotting to kill police officers and dynamite department stores as part of a Black Panther plot.",1
10,22395120,1711,"Mr. Jones was believed to have favored what the group called ''inversion'' or surfacing while Miss Boudin was believed to support continued armed violence.\n\n\nThe next trace of Mr. Jones and Miss Raskin was in Hoboken in 1979, when police raided an apartment where materials for making bombs were found.",0
11,22397338,1823,Jack Henry Abbott pleaded not guilty in State Supreme Court to charges that he stabbed a waiter to death last July 18.,1
12,22417160,1724,"Union Reports Factory Curbs\n\n\nWARSAW, Nov. 13 (Reuters) - Officials of Solidarity said today that authorities had declared a state of emergency in factories in the southern city of Czestochowa to restrict the union movement's activities.\n\nOfficials at the union's headquarters in Gdansk said the governor of Czestochowa imposed the state of emergency on Monday.",1
13,22438053,1822,"At the same time, at another rally about 12 blocks away, about 600 older men and women gathered in front of what was once the Ministry of Public Security to hear speeches attacking the ''Zionist clique,'' Jews who held positions of power during the Stalinist 1950's and who were said to have murdered and tortured Polish patriots.",1
14,22448035,182,"He paused briefly in the stinging cold to articulate a concern of black citizens of this industrial city on Lake Erie.\n\n\n''Since all these killings, I will tell you, I got my head turned every way but the right way looking for some white man to come up on me,'' said Mr. Hall, turning his face in one direction and then another.\n\nHe stood at the corner where a black man had been stabbed in the chest by a white assailant two days earlier.",1
15,22459482,182,"Vice President Joseph de Graft Johnson, who was arrested a few days later, has been beaten by guards while in custody, according to senior Ghanaian officials.\n\n\n\nThe country is being run by a seven-member Provisional National Defense Council, whose members were announced this week.",1
16,22474247,1724,"Mayor Eileen Anderson of Honolulu declared a state of emergency on Oahu.\n\n\nMeanwhile, the Navy was looking into the possibility of using a nuclear-powered submarine to supply energy for the island of Kauai, which remained without power.\n\n''There are a number of technical problems which will have to be answered before we know if it can work, but we are willing to do it if it is possible,'' said Lieutenant commander Terry Forrester, spokesman for the Commander in Chief of the Pacific.",1
17,22477534,182,"Anthony S. Earl, a former Democratic state cabinet member, beat Terry J. Kohler, a Republican businessman, winning 57 percent of the vote to Mr. Kohler's 42 percent.",0
18,22479706,1724,"The rest was split among the Tamil minority candidate and the three Marxist candidates.\n\nTwo hours after the polls closed Wednesday, Mr. Jayewardene ordered a state of emergency on Sri Lanka.",1
19,22485570,182,"He was beaten by a qualifier, Chris Mayotte of Springfield, Mass., 6-4, 3-6, 3-6, 7-6, 6-2.",0
20,22488684,1711,"Three Incidents Described\n\n\nA navy spokesman said the first incident took place last Thursday when the fishing boat Arengus was buzzed by a British Sea King helicopter and Harrier jet and later escorted out of the area by a British warship.\nA navy communique said the other two incidents reportedly took place Tuesday, when two Argentine fishing boats, the Api III and the Ursbill, were separately intercepted by Royal Navy ships and ordered out.\nThe fishing grounds off the Falklands are among the richest in the world.",0
21,22489357,185,"Under the standard applied in the Hinckley trial, for example (a Federal standard since Congress has made attempted assassination of the President a Federal crime), the Government was required to prove to the jury's satisfaction that he was sane beyond any reasonable doubt when he shot President Reagan and the three other men.",1
22,22499993,1712,"''Now, if you ask which one it could be,'' the brigadier said, ''we are evaluating and on this basis we will give the information about whether it is the Invincible or another.''\n\n\n\nThe Argentine Air Force has carried out most of the attacks against the British fleet in the South Atlantic, sinking five British ships.",0
23,22506081,1724,"Simpson said that the blaze destroyed more than 40 buildings containing more than 400 apartment units before it was brought under control about 6:30 A.M.\nGov. Edmund G. Brown Jr. declared a state of emergency in the county, and toured the community today.",1
24,22511194,1822,"He did not elaborate, but later told a reporter that he was subjected to ''psychological'' torture by two Salvadorans in Washington.",1
25,22523294,1711,"""President Hosni Mubarak of Egypt said today that Egyptian jet fighters had intercepted Libyan aircraft that violated his country's airspace.\n\nMr.",0
26,22527537,1712,"Cuban fighter planes attacked and sank the Bahamian ship; four lives were lost.\n\n\n\nTypically, when nations seize ships for fishing in what they regard as their waters or taking more than an allowable catch, they impose fines and confiscate the haul.",1
27,22533036,186,"On Nov. 28, 1971, the Prime Minister of Jordan, Wasfi Tell, was assassinated outside the Cairo Sheraton by Palestinian gunmen.",1
28,22543813,1823,"""A house painter charged with stabbing a man to death is a suspect in the slayings of 18 other men in three states, according to the authorities.\nThe suspect, Larry W. Eyler, 30 years old, of Chicago, has been under surveillance more than a month.\nHe was arrested Friday at the Federal courthouse in Chicago after suing Lake County, Ill., and the Indiana State Police for what he called harassment.",1
29,22549058,186," imposed on Oct. 6, 1981, the day President Anwar el-Sadat was assassinated by Moslem fundamentalists, is a certainty because the Government has a majority in Parliament.\nThe Interior Minister said that last February a foreign terrorist organization was rounded up in Cairo and found to possess some 496 pounds of explosives.",1
30,22553434,186,"The infamy of one of its offspring - John Wilkes Booth, who assassinated President Lincoln - has overshadowed the fame of one of his brothers, Edwin, whose relationship with the father, Junius Brutus, is the subject of the musical.\n\n\n\nIt was written by Austin Pendleton, who is usually known as an actor and director; in his last Broadway turn, Mr. Pendleton staged ''The Little Foxes'' with Elizabeth Taylor.",1
31,22562163,1823,"""Jurors began deliberations today in the trial of four Everett, Mass., police officers accused of beating a man to death in a brawl in a motel room last July.\nIn the four-week trial, witnesses described a confused and bloody early-morning brawl in which several civilians and police officers were hurt.",1
32,22574980,182,"O'Donnell, whose father is the attorney for Mrs. Bowden in the lawsuits, first became interested in the case when he was beaten and arrested by Boston police officers in what he and his family believe was an effort to frighten his father off the case.",1
33,22585780,1712,"Seized at 1:30 A.M.\n\nMr. Seguel, who heads Chile's largest union, the Copper Workers Confederation, was arrested at 1:30 A.M. by police detectives who broke down the door of an apartment here where he was sleeping.",0
34,22633407,186,"Mrs. Gandhi is assassinated in New Delhi by two gunmen identified by police officials as Sikh members of her own security\nguard.""",1
35,22633966,185,"Like the 1970's reports that the C.I.A. plotted with Mafia chiefs to kill Fidel Castro, conducted drug experiments on unwitting people and spied illegally on Americans who opposed the Vietnam War, the Nicaraguan operation has produced bitter divisions inside the agency.",1
36,22643818,1724,"""Three months after imposing martial law in Poland, Gen. Wojciech Jaruzelski, the Polish leader, flew to East Berlin in March 1982 for a hero's welcome by East Germany's Communist leaders, who were among the sharpest critics of Polish liberalization and had repeatedly called for a crackdown.",1
37,22650503,185," was among a small group of Arena members who were said to have planned to kill the Ambassador, Thomas R. Pickering.\n(In Washington, senior officials confirmed that the Administration had learned of a right wing Salvadoran plot to assassinate the Ambassador and that a high-level official had been sent to El Salvador to issue warnings to the plot leaders.",1
38,22661719,186,"His statements could not be confirmed.\nForeign journalists and a foreign human rights investigator have reported that a rebel unit executed as many as 11 Government soldiers last month in Cuapa, north of Juigalpa, in central Nicaragua.\n\nMr. Rodriguez said that it was not clear what happened in Cuapa, but that it appeared possible that rebels had executed some prisoners.",0
39,22673569,1711,"Mr. Pol Pot has been accused of being responsible for the deaths of more than two million Cambodians from 1975, when his group seized power from the American-backed Lon Nol Government, until the Khmer Rouge were forced into guerrilla warfare in 1978.",0
40,22693636,186,"Its interior is a sprawl of brown-brick walls, red carpets and fluorescent lights, possessing not a single clearly Japanese feature in any public room or corridor.\n\n\n\nTwice in the 1930's, military officers broke into the house to assassinate Prime Ministers, a bit of historical unpleasantness that may explain in part why only 3 of Japan's 16 postwar Prime Ministers have elected to live there.",1
41,22697139,1724,"\nSince September 1984 more than 1,000 people, the bulk of them black, have died in violent protest in this torn nation, and the authorities have declared a state of emergency in districts around Johannesburg, Cape Town and Port Elizabeth.",1
42,22714958,182,"They stopped and got out, only to be severely beaten by a gang of white men.",1
43,22715465,1822,"Police officials have rejected the assertions, saying they are unspecific.\n\n\nBut support committee officials contend that previous episodes in South Africa's handling of detainees, such as the death in police custody of the black consciousness leader Steve Biko in 1977, offer little hope that police methods have changed.\n\nLast year, Auret van Heerden, a white student activist who is one of the four whites currently detained, sued 10 security policemen, alleging that they tortured him while he was detained.",1
44,22716179,1821,"""A black leader from the township of Soweto asserted today that two black policemen raped a girl as she returned home from school this week.",1
45,22717454,1724,"#600 Died in Recent Unrest Over the last 11 months, more than 600 people have died in unrest in black residential areas, many in clashes with policemen and soldiers, prompting Mr. Botha on July 20 to declare a state of emergency in 36 districts around Johannesburg and in eastern Cape Province.",1
46,22726094,1711,"They also asked for the release of 2,000 Palestinians held by Amal and the mainly Shiite Sixth Brigade of the Lebanese Army.\n\nAmal's leader, Nabih Berri, said at a news conference here today that documents had been seized from the Palestinian prisoners showing what he termed a conspiracy by Yasir Arafat, the chairman of the Palestine Liberation Organization, to provoke national strife in Beirut.\n\n\nMr. Berri said Amal would release the papers when an investigation into the fighting in the settlements was completed.\nShiite fighters took full control of the Sabra settlement Friday.",1
47,22728134,1823,"""The central figure in a murder trial of secret policemen here portrayed himself today as an inexperienced, reluctant and even squeamish killer who inexplicably beat a pro-Solidarity priest to death after having been enticed into kidnapping the cleric with suggestions of support from ''the top.''",1
48,22729437,186,"Soviet security people virtually took control of a wing of the presidential palace where the Soviet leader stayed.\n\nSoviet officials made no secret of their concern about their leader's safety in a country whose Prime Minister, Indira Gandhi, was assassinated by two of her own security guards in 1984.",1
49,22735370,1822,"Ward said yesterday, however, that there was no indication that any superior officers besides the suspended sergeant were involved in wrongdoing.\n\nYesterday's transfers, which had been expected, were reminiscent of Mr. Ward's actions last year after officers at the 106th Precinct in Ozone Park, Queens, were accused of torturing prisoners with an electric stun gun.",1
50,22738128,1711,Newspapers Seized \n\n\nThe Hungarian specialist said Rumania prevented Hungarian newspapers from circulating and seized even single copies from Hungarian tourists or family visitors at the border.,1
51,22740745,185,"It was not clear if there was any link between the events.\n\nIn October 1981, Mr. Rabb left Italy suddenly, without even a change of clothes, after Italian authorities discovered a reported Libyan plot to assassinate him.",1
52,22748875,1724,"Aquino's revocation of limits on the writ of habeas corpus restored for the first time since Mr. Marcos declared martial law in 1972 the protection for all Filipinos against summary detention or imprisonment.\nShe presented her proclamation, with its symbolism of a renewal of human rights, in a dramatic reading of the full edict, replete with the legalistic language Mr. Marcos often employed in issuing decrees that restricted freedoms.\n\nThe decree quoted the 1981 proclamations of Mr. Marcos,",1
53,22758056,1711,"Two of the passports were confiscated by Libyan authorities from Tunisians who were expelled from Libya last summer, and one of them was reported lost by a Tunisian in Libya in 1977.",1
54,22765423,1821,"It was filed by Representative Ron Dellums, Democrat of California, suing as a private citizen; Myrna Cunningham, who said she was raped in Nicaragua by rebels, and Eleanor Ginsburg, who said United States paramilitary training took place near her Florida home.""",1
55,22778994,186,"An Indian newspaper suggested that he had been trying to emulate the Hindu extremist who assassinated Mohandas K. Gandhi, India's independence leader, in 1948.\n\nOfficials were clearly exercising caution before identifying the suspect's religion for fear of aggravating the already high tensions between Hindus and Sikhs.\n\nThousands of people have died in violence between Sikhs and Hindus in the last few years, and Sikh extremists carry out almost daily attacks on Hindus in Punjab state.",1
56,22784155,1712,"Civil rights groups monitoring the detentions say between 12,000 and 16,000 people, most of them black activists, have been seized.\n\n\nIn a separate development, the authorities in Cape Town, pursuing a campaign to disperse the residents of the huge squatter camp known as Crossroads, were said by witnesses today to have demolished the homes of more than 100 families.\n\nAlso In Cape Town, the Progressive Federal Party, the official white opposition party in the segregated three-chamber Parliament, took the unusual step of withdrawing its traditional cooperation with the Government in ordering parliamentary business.",1
57,22784158,1821,"""A nun was raped in the basement of a Manhattan convent late yesterday afternoon by a former handyman at the convent who last night surrendered to authorities, the police said.\nThe suspect, identified as Mauricio Espinal, 26 years old, of 1274 Fifth Avenue, turned himself in at the 23rd Precinct station house on East 102d Street at 9:45 P.M..\n''He knew were were looking for him,'' said Sgt. Edward Burns, a spokesman for the police department.\nSergeant Burns said the rape occurred at the convent at 5 P.M.,",1
58,22786394,1822,"Mr. Yurchenko made a dramatic return to the Soviet Union in November, contending that he had been kidnapped and tortured by the C.I.A.\nMr. Yurchenko also told the Americans that Ronald W. Pelton, a former employee of the National Security Agency, had sold information to the Soviet Union.",1
59,22807256,1823,"Most still remember Vincent Chin, a Chinese-American beaten to death five years ago in Detroit by two laid-off automobile workers who thought he was Japanese.",1
60,22807899,182,"\nLarry Davis, who is being held in prison on charges of killing five drug dealers and wounding six police officers, stabbed a correction officer in the head with a ballpoint pen yesterday, officials said.\n\nThe stabbing occurred at 12:20 P.M., as Mr. Davis was being returned to his cell in the Men's House of Detention on Rikers Island.",1
61,22809534,182,"Boris Becker, finding his touch in a high-quality final set, beat Tim Mayotte of the United States by 4-6, 7-6, 6-4 today and reached the final of the Stella Artois grass-court championships at Queens Club.",0
62,22812571,182,"\nBobby Czyz retained his International Boxing Federation light heavyweight title when he knocked out Willie Edwards at 2:16 of the second round of a scheduled 15-round bout today.\nBut as speedily as he dispatched his foe, Czyz's fight did not go without hitches.\nIn the opening round, Czyz had been consistently beating Edward to the punch when there was a dramatic turnabout.\n\nCzyz said afterward that he and Edwards, the 31-year old North American Boxing Federation light heavyweight champion, clashed heads toward the end of the round.",0
63,22820739,182,"In other first-round action, Adriana Villagran of Argentina defeated Wiltrud Probst of West Germany, 6-3, 3-6, 6-3, and Patricia Tarabini of Argentina beat Gabrielle Dinu of West Germany, 6-3, 6-1.",0
64,22821131,1822,"Verges has made it clear that he intends to call into question French behavior, not only during the war but in subsequent periods, such as this country's long battle against Algerian independence.\n\nHe is expected to argue that the accusations against Mr. Barbie are no worse than those leveled against the French Army, which is said to have tortured prisoners in Algeria.",1
65,22822059,1712,"The police dropped a bomb on a house occupied by members of the group after a confrontation, killing 11 people and destroying 61 homes.",1
66,22842166,1822,"The police in Kenya have tortured hundreds of people suspected of opposing the Government during a 16-month-old crackdown on a dissident Marxist group, Amnesty International charged today.",1
67,22852992,185,"\nA jury found a patrolman not guilty of murder Friday in the slaying of a fellow officer who was accused of being a vigilante and plotting to kill several officials.\nThe defendant, Farrell Tucker, who was standing, slumped into his chair and put his hands to his face when the verdict was pronounced.",1
68,22868514,1724,"Wojciech Jaruzelski today began his first official visit to the West since he imposed martial law in Poland five years ago.\n\nIn meetings with Italian Government leaders, he discussed ways to reduce Poland's diplomatic and economic Prime Minister Bettino Craxi told the general that respect for human rights is a ''priority sector'' in efforts to improve relations among European nations,",1
69,22868514,1724,Gen. Wojciech Jaruzelski today began his first official visit to the West since he imposed martial law in Poland five years ago.,1
70,22875528,1822,"Conviction in '86 Trial\n\n\n\nThe Police Department dismissed Mr. Pike, 43, after he was convicted in the first stun-gun trial, in 1986, of torturing a teen-age drug suspect with the battery-powered device.",1
71,22890687,1711," Mohammed Khames, 40 years old, died Monday in an exchange of fire with the police when they raided his apartment in Maadi, a suburb of Cairo.\nIn a separate incident Monday, the police arrested the second convict, Ahmed Aswani, 31, in the Ghamra area of the city after he was wounded in a gunfight while resisting arrest.\nMr.",1
72,22894275,185,"\nA law-enforcement official said today that a Missouri man who is accused of plotting to kill the Rev. Jesse Jackson made a statement to an informer implying that others had done the high-level planning.\n\nThe man, Londell Williams, 30 years old, a self-described member of a violent neo-Nazi terrorist group, and his wife, Tammy J. Williams, 27, have been charged in a Federal complaint with conspiring to kill or injure Mr. Jackson, the Democratic Presidential candidate;",1
73,22902717,1712,"They burned down his home, destroyed the only print of his movie, ''The Black President,'' and threw his 77-year old mother out of a second-story window.",1
74,22910492,1822,"Facing the man she said beat and tortured her, Hedda Nussbaum testified yesterday at the murder trial of Joel B. Steinberg, telling the jury that he handed her the unconscious form of Lisa Steinberg on the evening of Nov. 1, 1987, the night the prosecution says he gave the child a fatal beating.",1
75,22917177,1711,A Federal appeals court ruled 8 to 4 yesterday that the Government could not prevent defendants from hiring the lawyers of their choice by freezing and seizing the defendants' assets.,1
76,22917684,185,"\nAs Pope John Paul II ended his Austrian tour today with warm thanks to President Kurt Waldheim, a news report said a new plot by Turkish extremists to assassinate the Pope had been foiled in Vienna.\nOn May 13, 1981, a Turkish terrorist shot and badly wounded the Pope in St. Peter's Square.\n\nABC News in New York quoted unidentified sources as saying two Turkish extremists were the prime suspects in the latest assassination plot.",1
77,22924572,186,"Hosts Are Polite \n\nAlthough the Hungarian information outlets have criticized Israeli actions in repressing Palestinian demonstrations in the occupied territories and accused Israel of the assassination of Abu Jihad, the military commander of the Palestine Liberation Organization, Mr. Peres suggested that the Hungarian leaders had not emphasized their opposition.",1
78,22931137,182,"''A guy from Massachusetts beat him in Texas, beat him in Florida.",0
79,23001157,1822,"Confucian Ideal Vs. Popular Culture Before June 1987, intelligence agents and police officers routinely detained, interrogated and tortured people like Kim Keun Tae, an intellectual active in the underground labor movement.\n\n\nNow Kim Keun Tae and hundreds like him are out of jail, freed by a series of presidential amnesties.",1
80,23005041,1821,"In another case, two assailants, after having met a young woman at a campus party, raped her in a nearby residence hall.",1
81,23026721,1724,"Armored personnel carriers patrolled the city, streets were littered with papers, store windows were broken and one man was shown stealing milk from a vandalized store.\n\n\nParty Offices Attacked &lt;break/&gt;\n\n\nThe authorities declared a state of emergency in Dushanbe on Monday, after mobs stormed the Communist Party headquarters and set fire to its first two floors.",1
82,23061946,1823,"o not worry, I will not die, Satan,"""" stabbed his mother to death and wounded his father with a kitchen knife at a Thanksgiving Day gathering yesterday, the police and neighbors said.",1
